{
  "schema_version": 1,
  "language": "python",
  "symptom": "lalr-construction-infinite-loop",
  "severity": "bug",
  "tags": ["lark", "lalr", "cyk", "grammar-priority", "infinite-loop"],
  "expected_verdict": "reproduced",
  "expected_runtime": "pyodide",
  "upstream": {
    "registry": "pypi",
    "package": "lark",
    "version": "1.3.1"
  }
}
