{
  "schema_version": 1,
  "language": "python",
  "symptom": "solver-asymmetry-on-nonsingular-matrix",
  "severity": "bug",
  "tags": [
    "numerical-linear-algebra",
    "qr-solve",
    "householder",
    "arbitrary-precision"
  ],
  "expected_verdict": "reproduced",
  "expected_runtime": "pyodide"
}
