{
  "schema_version": 1,
  "language": "shell",
  "symptom": "missing-bin-link",
  "severity": "bug",
  "tags": [
    "aube",
    "node",
    "package-manager",
    "bin",
    "link-protocol"
  ],
  "expected_verdict": "reproduced",
  "expected_runtime": "formicarium",
  "guests": [
    {
      "role": "baseline",
      "tool": "aube",
      "repository": "https://github.com/aubepkg/aube",
      "commit": "dc0f6f80811270b3e3b2dffdb58c5e335487fd36",
      "fixture": "aube-link-dep-bins",
      "reference": {
        "branch": "main"
      },
      "accepted": {
        "commit": "dc0f6f80811270b3e3b2dffdb58c5e335487fd36",
        "versionOrName": "dc0f6f80811270b3e3b2dffdb58c5e335487fd36",
        "buildKey": "4f4080eb645a16d8e355c9ce5004b2f4cad734f560f33aee3f4a1015bc1e2e17",
        "elfSha256": "bce70243db2349e5469a96899606056cd2c80a26f4fcad90e41e7164c674c8ae",
        "buildInfoSha256": "43d150815f53fe7e9429ace39c4c612dfac6dcc7055f5b5955b590e443efd443"
      }
    },
    {
      "role": "fix",
      "tool": "aube",
      "repository": "https://github.com/jambalaya56562/aube",
      "commit": "0a6137570b30445bd5ac76b2a6d7701ea15b4785",
      "fixture": "aube-link-dep-bins",
      "reference": {
        "branch": "link-transitive-link-dep-bins"
      },
      "accepted": {
        "commit": "0a6137570b30445bd5ac76b2a6d7701ea15b4785",
        "versionOrName": "0a6137570b30445bd5ac76b2a6d7701ea15b4785",
        "buildKey": "8c3f68102545dfa1f4550c56befc72d7bc58a4f9852400f0c8cc2958cf915093",
        "elfSha256": "df94311b449811f742dcfe3c59bc0d79ea8173b162577ea71f94f5c4fda6806b",
        "buildInfoSha256": "b5dc787a1122acb4c38b1196cd26d8fe361cf8198bbbad8a686faa11ce273828"
      }
    }
  ]
}
