{
  "schema_version": 1,
  "language": "shellsession",
  "symptom": "wrong-lockfile-version",
  "severity": "bug",
  "tags": ["aube", "lockfile", "package-manager", "terrarium"],
  "expected_verdict": "reproduced",
  "expected_runtime": "terrarium",
  "upstream": {
    "registry": "github",
    "repository": "aubepkg/aube",
    "version": "v2.6.1",
    "commit": "bd94e42f54d3b5e3dd102716b7197f316cb5f4ed"
  }
}
