{
  "schema_version": 1,
  "language": "shell",
  "symptom": "migration-option-dropped",
  "severity": "bug",
  "tags": [
    "biome",
    "prettier",
    "migration",
    "formatter",
    "json"
  ],
  "expected_verdict": "reproduced",
  "expected_runtime": "formicarium",
  "guests": [
    {
      "role": "baseline",
      "tool": "biome",
      "repository": "https://github.com/biomejs/biome",
      "commit": "343c8ca9cc718d76717b334338cc7eff94b0d426",
      "fixture": "biome-migrate-prettier-bracket-spacing",
      "reference": {
        "branch": "main"
      },
      "accepted": {
        "commit": "343c8ca9cc718d76717b334338cc7eff94b0d426",
        "versionOrName": "343c8ca9cc718d76717b334338cc7eff94b0d426",
        "buildKey": "84e80b0dc1e54667941329f70d9d75aeeeace31146af04e2f97bf204aa77cb73",
        "elfSha256": "fcdb92c91396723bf19f0da12a71e7e7b1cf027cf5875915a225933aeb0ba7a3",
        "buildInfoSha256": "2afd25a437b1f26cef58ae87e0471002f21b6ddb8b9ceaaae71a0136e5430cdd"
      }
    },
    {
      "role": "fix",
      "tool": "biome",
      "repository": "https://github.com/jambalaya56562/biome",
      "commit": "c023cb4bde6b7da703ec8f73fea1807501f6bf91",
      "fixture": "biome-migrate-prettier-bracket-spacing",
      "reference": {
        "branch": "fix/migrate-prettier-bracket-spacing"
      },
      "accepted": {
        "commit": "c023cb4bde6b7da703ec8f73fea1807501f6bf91",
        "versionOrName": "c023cb4bde6b7da703ec8f73fea1807501f6bf91",
        "buildKey": "999c685da090c053fe294038463adc16bb99d6f8a62cb61848060d0e8b6d8a36",
        "elfSha256": "bd96d98fe5b2e24c3bd5610ac4b848f90d54d54cb67dbabe06a8a3c0120a1a4c",
        "buildInfoSha256": "378d84741d0b3b15b34f29e1f3cbeddac125c7f562e31674bb5884c3e4c9ad1e"
      }
    }
  ]
}
