{
  "schema_version": 1,
  "language": "shell",
  "symptom": "incorrect-migration-defaults",
  "severity": "bug",
  "tags": ["biome", "prettier", "migration", "formatter", "defaults"],
  "expected_verdict": "reproduced",
  "expected_runtime": "terrarium",
  "fix_candidate": {
    "repository": "JamBalaya56562/biome",
    "branch": "fix/migrate-prettier-default-semi-quotes",
    "commit": "f79f85d58ae499647c127f1e90a4931e3dbbb206"
  }
}
